{
  "ok": true,
  "review": {
    "reviewId": "01JAC7Q2HV5M8N3P4R6S9T0W1X",
    "siteId": "site_9f3c2a7b41d0",
    "reviewNo": 42,
    "entryId": "01JAB4M9ZQ7X3K2V8N5T6R1W0C",
    "entryNo": 118,
    "collection": "pages",
    "slug": "hot-tub-repair",
    "path": "/spa-services/hot-tub-repair/",
    "title": "Hot Tub Repair for Most Brands",
    "status": "published",
    "statusLabel": "Published",
    "stage": "published",
    "readyToPublish": false,
    "entryStatus": "published",
    "updateMode": true,
    "parentEntryId": "01JAB4M9ZQ7X3K2V8N5T6R1W0C",
    "round": 1,
    "seq": 6,
    "rev": 6,
    "contentType": "service_page",
    "submittedBy": {
      "memberId": "c9f0f895-fb98-4b91-a5b3-0e1d2c3b4a59",
      "name": "Sam Worker"
    },
    "pmAssigned": {
      "memberId": "8f14e45f-ceea-467a-9575-5f3c1b2a7d90",
      "name": "Jane PM"
    },
    "pmDecision": "approved",
    "pmComment": "Good to go",
    "pmReviewedAt": "2026-10-15T11:59:58Z",
    "clientDecision": "approved",
    "clientComment": "Looks great",
    "clientReviewedAt": "2026-10-16T09:00:00Z",
    "workerNote": "Refreshed FAQ",
    "draftRevisionId": "01JAC6ZK3D4F5G6H7J8K9M0N1P",
    "liveRevisionId": "01JA9Y1B2C3D4E5F6G7H8J9K0M",
    "pmPreviewUrl": null,
    "clientPreviewUrl": null,
    "linksExpireAt": {
      "pm": "2026-10-22T11:00:00Z",
      "client": "2026-10-29T12:00:00Z"
    },
    "editUrl": "https://oasispoolspas.com/_emdash/admin/content/pages/01JAB4M9ZQ7X3K2V8N5T6R1W0C",
    "seoGate": null,
    "publishedAt": "2026-10-16T14:00:00Z",
    "scheduledAt": null,
    "cancelledReason": null,
    "createdAt": "2026-10-15T11:00:00Z",
    "updatedAt": "2026-10-15T12:00:00Z",
    "history": [],
    "links": {
      "pm": {
        "state": "revoked",
        "issuedAt": "2026-10-15T11:00:00Z",
        "expiresAt": "2026-10-22T11:00:00Z"
      },
      "client": {
        "state": "revoked",
        "issuedAt": "2026-10-15T12:00:00Z",
        "expiresAt": "2026-10-29T12:00:00Z"
      }
    },
    "publishedBy": {
      "kind": "human",
      "name": "Jane PM",
      "osUserId": "8f14e45f-ceea-467a-9575-5f3c1b2a7d90",
      "role": "PM",
      "source": "os"
    },
    "publishOrigin": "os",
    "override": null
  },
  "entry": {
    "entryId": "01JAB4M9ZQ7X3K2V8N5T6R1W0C",
    "entryNo": 118,
    "collection": "pages",
    "slug": "hot-tub-repair",
    "path": "/spa-services/hot-tub-repair/",
    "title": "Hot Tub Repair for Most Brands",
    "status": "published",
    "hasPendingDraft": false,
    "draftRevisionId": null,
    "liveRevisionId": "01JAC6ZK3D4F5G6H7J8K9M0N1P",
    "seo": {
      "title": "Hot Tub Repair in Waukesha & Milwaukee | Oasis Pool and Spa",
      "description": "Hot tub not heating? Oasis repairs most spa brands across Waukesha and Milwaukee.",
      "canonical": null,
      "noIndex": false
    },
    "contentHash": "9b1f0c2d3e4a5b6c7d8e9f00112233445566778899aabbccddeeff0011223344",
    "wordCount": 812,
    "excerpt": "Oasis diagnoses and repairs most hot tub brands.",
    "updatedAt": "2026-10-15T12:01:00Z",
    "publishedAt": "2026-10-16T14:00:00Z",
    "scheduledAt": null,
    "editUrl": "https://oasispoolspas.com/_emdash/admin/content/pages/01JAB4M9ZQ7X3K2V8N5T6R1W0C",
    "template": null,
    "outline": {
      "headings": [
        {
          "level": 1,
          "text": "Hot Tub Repair for Most Brands"
        },
        {
          "level": 2,
          "text": "Hot tub repair questions"
        },
        {
          "level": 3,
          "text": "Why is my hot tub not heating?"
        }
      ],
      "internalLinks": [
        "/spa-services/",
        "/contact/"
      ],
      "externalLinkCount": 0,
      "imageCount": 1
    },
    "outlineHash": "fdf9c0ae7d0c95ee25b6921c6d0c988a9893787520d142903b1f1637f7cf672b",
    "rev": "01JAC6ZK3D4F5G6H7J8K9M0N1P"
  },
  "publishedAt": "2026-10-16T14:00:00Z",
  "liveRevisionId": "01JAC6ZK3D4F5G6H7J8K9M0N1P",
  "seoCheck": {
    "ran": true,
    "variant": "draft",
    "ok": true,
    "summary": {
      "block": 0,
      "warn": 1,
      "info": 0
    },
    "failed": [
      {
        "id": "kw.primary-lead",
        "severity": "warn",
        "message": "Primary keyword not in the first 100 words",
        "path": "lead"
      }
    ],
    "contract": {
      "version": 3,
      "locked": true
    }
  }
}
